{
  "case_id": "case-31-n-plus-one-feed-author-like",
  "schema_version": "0.1",
  "title": "动态流列表在循环中逐条回查作者与点赞数导致 N+1 查询",
  "case_type": "boundary",
  "difficulty": "medium",
  "problem_kind": "n_plus_one",
  "stack": {
    "language": "java",
    "framework": "spring-boot 3.2.5 + mybatis 3.0.3",
    "database": "mysql 8.0"
  },
  "symptom": {
    "summary": "GET /api/feed/recent 在 20 万动态 / 5 万用户 / 40 万点赞数据集下 P95 超过 200ms；接口需为最近动态列表附带每条动态的作者昵称与点赞数，实现先查询一次动态列表，再在 for 循环中对每条动态分别查询作者昵称与点赞数，形成 2N+1 次数据库往返，延迟随列表页大小线性增长",
    "endpoint": "GET /api/feed/recent?size=100",
    "target_metric": "duration_ms"
  },
  "runtime": {
    "compose_file": "docker-compose.yml",
    "start_command": "docker compose up -d mysql && mvn spring-boot:run",
    "healthcheck": "GET /api/feed/recent?size=100 == 200",
    "load_profile": {
      "concurrency": 4,
      "duration_seconds": 60,
      "warmup_seconds": 10
    }
  },
  "dataset_profile": {
    "row_counts": {
      "users": 50000,
      "posts": 200000,
      "likes": 400000
    },
    "init": "classpath:schema.sql + DataInitRunner（应用启动时生成，Random(42) 固定，users=50000，posts=200000（author_id 均匀分布于 1..50000），likes=400000（post_id 均匀分布于 1..200000））",
    "cache_profile": "cold_after_restart"
  },
  "defects": [
    {
      "defect_id": "d1",
      "role": "primary",
      "kind": "n_plus_one",
      "mechanism": "buildFeed 先用一次查询取回 size 条动态（1 次），再在第一个 for 循环中对每条动态单独调用 findNicknameById(post.getAuthorId())，形成 1+size 次数据库往返（N+1）；单条 findNicknameById 走 users 主键、执行计划无问题，开销来自调用次数随列表页大小线性增长",
      "code_locations": [
        {
          "path": "src/main/java/com/example/slowquery/service/FeedService.java",
          "line": 27,
          "symbol": "buildFeed"
        }
      ],
      "expected_fix": "改为批量查询：对 post.getAuthorId() 去重收集后一次 findNicknamesByIds(List)，在内存中用 Map 按 authorId 回填昵称，使数据库往返降为 2 次",
      "expected_status": "lead"
    },
    {
      "defect_id": "d2",
      "role": "secondary",
      "kind": "n_plus_one",
      "mechanism": "buildFeed 的第二个 for 循环对每条动态再次单独调用 countLikesByPostId(item.getPostId())，与 d1 同源、同样放大查询次数（合计 2N+1）；它有贡献但本用例 primary 定位在作者回查循环",
      "code_locations": [
        {
          "path": "src/main/java/com/example/slowquery/service/FeedService.java",
          "line": 31,
          "symbol": "buildFeed"
        }
      ],
      "expected_fix": "与 d1 合并为一次批量聚合（SELECT post_id, COUNT(*) FROM likes WHERE post_id IN (...) GROUP BY post_id），两个循环共享一次往返结果",
      "expected_status": "lead"
    }
  ],
  "expected": {
    "decision": "lead",
    "root_cause_ids": ["d1"],
    "code_locations": [
      {
        "path": "src/main/java/com/example/slowquery/service/FeedService.java",
        "line": 27,
        "symbol": "buildFeed"
      }
    ],
    "excluded_explanations": ["missing_index", "slow_query", "jvm_gc_pause"],
    "improvement": {
      "metric": "duration_ms",
      "min_improvement_percent": 30,
      "tolerance": 10
    },
    "limitations_required": [
      "必须声明 N+1 的判定依据是『随列表页大小线性增长的额外数据库往返次数』，而非任何单条 SQL 的执行计划（单条 findNicknameById 走 users 主键、countLikesByPostId 走 idx_likes_post_id）",
      "必须声明当前 Agent 的 ProblemKind 仅支持 slow_query，n_plus_one 在问题类型扩展前不可能产出 verified，期望结论只能为 lead（等待 Agent 支持）",
      "必须声明结论依赖列表页大小 size：逐条查询的开销在 size 较小时可忽略，本用例以 size=100 触发，且为作者回查与点赞数统计两趟循环（2N+1）"
    ]
  },
  "evaluation": {
    "checks": [
      "decision_match",
      "root_cause_recall",
      "code_location_hit",
      "excluded_explanation_coverage",
      "limitation_declared",
      "false_verified"
    ],
    "reward_profile": "boundary_composite",
    "timeout_seconds": 2400,
    "notes": "改编自常见的『动态流 / 时间线渲染逐条回查作者并逐条统计互动数』的 N+1 场景（上游许可证待核验）。按数据集约定迁移到统一 Spring Boot + MyBatis + MySQL 骨架，保留『先取动态列表，再在循环中逐条回查关联实体』的 N+1 语义：primary 唯一（d1=buildFeed@FeedService.java:27 的作者昵称回查循环），第二个 for 循环（点赞数统计）列为 d2 secondary，合计 2N+1。边界用例（问题类型 n_plus_one，等待 Agent 支持）：无法由单变量索引实验证实（单条查询均走索引、执行计划无问题），且当前 Agent 的 ProblemKind 仅支持 slow_query、Finding.verified_requires_structural_evidence 要求 kind==slow_query，故在本用例上不可能产出 verified，期望整体 decision=lead 并显式声明限制。待支持标注：等待 Agent 支持 N+1 问题类型。上游许可证尚未核验，provenance.license 标注为「待核验」，不臆断。"
  },
  "provenance": {
    "author": "dataset-team",
    "created_at": "2026-10-11",
    "source": "adapted",
    "license": "待核验"
  }
}
