{
  "case_id": "case-26-n-plus-one-category-count-loop",
  "schema_version": "0.1",
  "title": "后台统计按分类循环逐条 COUNT/SUM 导致 N+1 查询",
  "case_type": "boundary",
  "difficulty": "medium",
  "problem_kind": "n_plus_one",
  "stack": {
    "language": "java",
    "framework": "spring-boot 3.2.5 + mybatis 3.0.3",
    "database": "mysql 8.0"
  },
  "symptom": {
    "summary": "GET /api/admin/stats 在 20 万订单 / 100 个分类数据集下 P95 超过 200ms；接口需为每个分类统计订单数与金额，实现先查全部去重分类，再在 for 循环中对每个分类逐条 COUNT 与 SUM，形成 2N+1 次数据库往返，延迟随分类数线性增长",
    "endpoint": "GET /api/admin/stats",
    "target_metric": "duration_ms"
  },
  "runtime": {
    "compose_file": "docker-compose.yml",
    "start_command": "docker compose up -d mysql && mvn spring-boot:run",
    "healthcheck": "GET /api/admin/stats == 200",
    "load_profile": {
      "concurrency": 4,
      "duration_seconds": 60,
      "warmup_seconds": 10
    }
  },
  "dataset_profile": {
    "row_counts": {
      "orders": 200000
    },
    "init": "classpath:schema.sql + DataInitRunner（应用启动时生成，Random(42) 固定，orders=200000，category 取值 cat-001..cat-100 均匀分布，amount 100..9999）",
    "cache_profile": "cold_after_restart"
  },
  "defects": [
    {
      "defect_id": "d1",
      "role": "primary",
      "kind": "n_plus_one",
      "mechanism": "buildStats 先查询全部去重分类（1 次），再在 for 循环中对每个分类单独调用 countByCategory，形成 1+N 次数据库往返（N+1）；单条 COUNT 按 idx_orders_category 走索引、执行计划无问题，开销来自调用次数随分类数线性增长",
      "code_locations": [
        {
          "path": "src/main/java/com/example/slowquery/service/OrderStatsService.java",
          "line": 26,
          "symbol": "buildStats"
        }
      ],
      "expected_fix": "改为一次 GROUP BY category 的聚合查询（SELECT category, COUNT(*) FROM orders GROUP BY category），在内存中组织结果，使数据库往返降为常数次",
      "expected_status": "lead"
    },
    {
      "defect_id": "d2",
      "role": "secondary",
      "kind": "n_plus_one",
      "mechanism": "buildStats 的第二个 for 循环对每个分类再次单独调用 sumAmountByCategory，与 d1 同源、同样放大查询次数（合计 2N+1）；它有贡献但本用例 primary 定位在 countByCategory 循环",
      "code_locations": [
        {
          "path": "src/main/java/com/example/slowquery/service/OrderStatsService.java",
          "line": 30,
          "symbol": "buildStats"
        }
      ],
      "expected_fix": "与 d1 合并为一次 GROUP BY 聚合查询（COUNT 与 SUM 同一趟返回）",
      "expected_status": "lead"
    }
  ],
  "expected": {
    "decision": "lead",
    "root_cause_ids": ["d1"],
    "code_locations": [
      {
        "path": "src/main/java/com/example/slowquery/service/OrderStatsService.java",
        "line": 26,
        "symbol": "buildStats"
      }
    ],
    "excluded_explanations": ["missing_index", "slow_query", "jvm_gc_pause"],
    "improvement": {
      "metric": "duration_ms",
      "min_improvement_percent": 30,
      "tolerance": 10
    },
    "limitations_required": [
      "必须声明 N+1 的判定依据是『随分类数线性增长的额外数据库往返次数』，而非任何单条 SQL 的执行计划（单条 COUNT/SUM 均可走 idx_orders_category 索引）",
      "必须声明 n_plus_one 现已由 Agent 的 ProblemKind 支持，本用例期望结论为 lead 属数据集设定的边界（并非因问题类型不受支持）：本用例未纳入『循环逐条 vs 批量合并』判别实验与批量改造后复测增益等结构化证据，不足以支撑整体 verified",
      "必须声明结论依赖分类数量与数据规模：分类数较小时逐条查询开销可忽略，本用例以约 100 个分类触发"
    ]
  },
  "evaluation": {
    "checks": [
      "decision_match",
      "root_cause_recall",
      "code_location_hit",
      "excluded_explanation_coverage",
      "limitation_declared",
      "false_verified"
    ],
    "reward_profile": "boundary_composite",
    "timeout_seconds": 2400,
    "notes": "改编自 tailwind8/portfolio-reserve Issue #68（main@b3bfbf5228c276ba696dd78ff84fed5741a80d33；上游 Next.js 在 src/app/api/admin/stats/route.ts 的 for 循环内逐分类调用 Prisma count，查询数由 100 增至 101；许可证待核验）。按数据集约定迁移到统一 Spring Boot + MyBatis + MySQL 骨架，保留『先取分类列表，再在循环中逐分类聚合』的 N+1 语义：primary 唯一（d1=buildStats@OrderStatsService.java:26 的 countByCategory 循环），第二个 for 循环（sumAmountByCategory）列为 d2 secondary。边界用例（问题类型 n_plus_one，Agent 现已支持该类型）：无法由单变量索引实验证实（单条聚合按 idx_orders_category 执行计划无问题），且本用例未纳入『循环逐分类 vs GROUP BY 合并』判别实验与批量改造后复测增益等结构化证据；具备完整证据链的同类用例（如 case-07）可产出 verified，本用例受证据链所限仍取 lead，期望整体 decision=lead 并显式声明限制。"
  },
  "provenance": {
    "author": "dataset-team",
    "created_at": "2026-10-11",
    "source": "adapted",
    "license": "待核验"
  }
}
