{
  "case_id": "case-19-large-response-unbounded-json",
  "schema_version": "0.1",
  "title": "发布信息接口无上限地一次性读取全部 release JSON，响应体达数十 MB",
  "case_type": "boundary",
  "difficulty": "medium",
  "problem_kind": "large_response",
  "stack": {
    "language": "java",
    "framework": "spring-boot 3.2.5 + mybatis 3.0.3",
    "database": "mysql 8.0"
  },
  "symptom": {
    "summary": "GET /api/providers/releases 无上限地把全部 provider_releases 记录（含单条约 6 KB 的 payload JSON）一次性读入并序列化返回，单次响应体约 30 MB，超过上游约定的 16 MiB 上限；耗时与内存峰值集中在结果序列化与网络传输，而非 SQL 计划本身。",
    "endpoint": "GET /api/providers/releases",
    "target_metric": "duration_ms"
  },
  "runtime": {
    "compose_file": "docker-compose.yml",
    "start_command": "docker compose up -d mysql && mvn spring-boot:run",
    "healthcheck": "GET /api/providers/releases == 200",
    "load_profile": {
      "concurrency": 4,
      "duration_seconds": 60,
      "warmup_seconds": 10
    }
  },
  "dataset_profile": {
    "row_counts": {
      "provider_releases": 5000
    },
    "init": "classpath:schema.sql + DataInitRunner（应用启动时生成，Random(42) 固定，provider 在 5 类间轮转，provider_releases=5000，payload 约 6 KB）",
    "cache_profile": "cold_after_restart"
  },
  "defects": [
    {
      "defect_id": "d1",
      "role": "primary",
      "kind": "unbounded_response",
      "mechanism": "列表接口无分页地 SELECT * 返回 provider_releases 全表约 5000 行，并逐行序列化含 payload（约 6 KB JSON）的完整实体，单次响应体约 30 MB，远超上游约定的 16 MiB 上限；瓶颈在结果序列化与网络传输（而非 SQL 计划本身），与上游『无上限读取 release 信息 JSON』同源。",
      "code_locations": [
        {
          "path": "src/main/java/com/example/slowquery/mapper/ProviderReleaseMapper.java",
          "line": 24,
          "symbol": "findAllReleases"
        }
      ],
      "expected_fix": "为响应体施加上限（如上游的 16 MiB）并分页/流式返回（瘦 DTO，去掉 payload 等大字段），超限即失败，避免一次性返回全表",
      "expected_status": "lead"
    }
  ],
  "expected": {
    "decision": "lead",
    "root_cause_ids": ["d1"],
    "code_locations": [
      {
        "path": "src/main/java/com/example/slowquery/mapper/ProviderReleaseMapper.java",
        "line": 24,
        "symbol": "findAllReleases"
      }
    ],
    "excluded_explanations": ["missing_index", "slow_query", "n_plus_one", "connection_pool"],
    "improvement": {
      "metric": "duration_ms",
      "min_improvement_percent": 50,
      "tolerance": 10
    },
    "limitations_required": [
      "必须声明本用例的瓶颈在响应体序列化与网络传输，用 duration_ms 只能间接体现，需结合响应字节数/返回行数等指标才能定量归因。",
      "必须声明当前 Agent 的 ProblemKind 仅支持 slow_query / n_plus_one / deep_pagination，large_response 在问题类型扩展前不可能产出 verified，期望结论只能为 lead（等待 Agent 支持）。",
      "必须声明该现象随数据量增长而放大，在小数据集上不可观测，结论依赖当前 5000 行 × 约 6 KB payload 的规模。"
    ]
  },
  "evaluation": {
    "checks": [
      "decision_match",
      "root_cause_recall",
      "code_location_hit",
      "excluded_explanation_coverage",
      "limitation_declared",
      "false_verified"
    ],
    "reward_profile": "boundary_composite",
    "timeout_seconds": 2400,
    "notes": "单 primary 缺陷 boundary 用例：无界响应体型 large_response，改编自 openclaw/openclaw PR #97536（机制标签 unbounded_response_body，为 release 信息 JSON 引入 16 MiB 上限）。统一骨架下保留上游『无上限读取 release 信息 JSON』的原汁原味：provider_releases 全表 SELECT * + 逐行序列化约 6 KB 的 payload，耗时来自序列化/传输而非缺索引；无法用单变量索引实验证实，且当前 Agent 问题类型仅支持 slow_query / n_plus_one / deep_pagination，期望 lead 并声明限制。用于检验 Agent 是否能把『响应体过大』从 SQL 计划层区分出来。等待 Agent 支持 large_response。"
  },
  "provenance": {
    "author": "dataset-team",
    "created_at": "2026-10-11",
    "source": "adapted",
    "license": "MIT"
  }
}
